{
 "schema": 1,
 "status": "seed - measurements by Precisit, 2026-10",
 "evidence_tags": [
  "observed",
  "reported",
  "inferred",
  "unknown"
 ],
 "rate_units": "GOPS best of five tiles, 2048x4096x4096, mode::multiply; vs_f16 divides the same receipt's f16*f16->f32 rate",
 "chips": {
  "m5-air": {
   "device_name": "Apple M5",
   "architecture": "applegpu_g17g",
   "memory_gb": 32,
   "mlx_at_measurement": "0.32.3",
   "evidence": "observed",
   "features": {
    "int8_accelerated": true,
    "fp8_accelerated": false,
    "fp4_accelerated": false
   },
   "float_lanes": {
    "e4m3*e4m3->f32": {
     "gops_best": 14061.928820519672,
     "receipt": "receipts/m5-air/lane_sweep_v4.json",
     "vs_f16": 1.078
    },
    "t_e4m3*e4m3->f32": {
     "gops_best": 14522.928389293847,
     "receipt": "receipts/m5-air/lane_sweep_v4.json",
     "vs_f16": 1.114
    },
    "mx_e4m3*e4m3->f32": {
     "gops_best": 10517.146729664502,
     "receipt": "receipts/m5-air/lane_sweep_v4.json",
     "vs_f16": 0.807
    },
    "mx_fp4*fp4->f32": {
     "gops_best": 9505.808622650982,
     "receipt": "receipts/m5-air/lane_sweep_v4.json",
     "vs_f16": 0.729
    },
    "f16*f16->f32": {
     "gops_best": 13039.851251390714,
     "receipt": "receipts/m5-air/lane_sweep_v4.json",
     "vs_f16": 1.0
    },
    "fp4*fp4->f32": {
     "gops_best": 12081.569292143662,
     "receipt": "receipts/m5-air/lane_sweep_v4.json",
     "vs_f16": 0.927
    },
    "f16*f16->f16": {
     "gops_best": 12563.071415421593,
     "receipt": "receipts/m5-air/integer_lanes.json",
     "vs_f16": 1.043
    },
    "bf16*bf16->f32": {
     "gops_best": 11727.727448276453,
     "receipt": "receipts/m5-air/integer_lanes.json",
     "vs_f16": 0.974
    }
   },
   "mixed_lanes": {
    "f16_mx_fp4->f32": {
     "gops_best": 9528.215377591598,
     "receipt": "receipts/m5-air/lane_sweep_mixed.json",
     "vs_f16": 0.726
    },
    "f16*fp4->f32": {
     "gops_best": 12510.751955122592,
     "receipt": "receipts/m5-air/lane_sweep_mixed.json",
     "vs_f16": 0.953
    },
    "f16*e4m3->f32": {
     "gops_best": 13742.638809289692,
     "receipt": "receipts/m5-air/lane_sweep_mixed.json",
     "vs_f16": 1.047
    },
    "f16_mx_e4m3->f32": {
     "gops_best": 9742.606696390585,
     "receipt": "receipts/m5-air/lane_sweep_mixed.json",
     "vs_f16": 0.742
    },
    "f16*i8->f32": {
     "gops_best": 11259.950054503382,
     "receipt": "receipts/m5-air/integer_lanes.json",
     "vs_f16": 0.935
    },
    "f16*i4b->f32": {
     "gops_best": 13353.905167432547,
     "receipt": "receipts/m5-air/integer_lanes.json",
     "vs_f16": 1.109
    }
   },
   "integer_lanes": {
    "i8*i8->i32": {
     "gops_best": 24470.8411611302,
     "receipt": "receipts/m5-air/integer_lanes.json",
     "vs_f16": 2.032
    },
    "i8*i4b->i32": {
     "gops_best": 21150.758876509637,
     "receipt": "receipts/m5-air/integer_lanes.json",
     "vs_f16": 1.756
    }
   },
   "gpu_cores": 10,
   "note": "Measured on the 10-core M5 Air SKU (M5 Air ships with fewer GPU cores in some configurations); other SKUs were not measured."
  },
  "m5-max": {
   "device_name": "Apple M5 Max",
   "architecture": "applegpu_g17s",
   "memory_gb": 128,
   "mlx_at_measurement": "0.32.3",
   "evidence": "observed",
   "features": {
    "int8_accelerated": true,
    "fp8_accelerated": false,
    "fp4_accelerated": false
   },
   "float_lanes": {
    "e4m3*e4m3->f32": {
     "gops_best": 54589.825972882885,
     "receipt": "receipts/m5-max/lane_sweep_v4.json",
     "vs_f16": 1.013
    },
    "t_e4m3*e4m3->f32": {
     "gops_best": 54345.17628899407,
     "receipt": "receipts/m5-max/lane_sweep_v4.json",
     "vs_f16": 1.009
    },
    "mx_e4m3*e4m3->f32": {
     "gops_best": 45949.57680113758,
     "receipt": "receipts/m5-max/lane_sweep_v4.json",
     "vs_f16": 0.853
    },
    "mx_fp4*fp4->f32": {
     "gops_best": 39990.01227340366,
     "receipt": "receipts/m5-max/lane_sweep_v4.json",
     "vs_f16": 0.742
    },
    "f16*f16->f32": {
     "gops_best": 53885.3316348217,
     "receipt": "receipts/m5-max/lane_sweep_v4.json",
     "vs_f16": 1.0
    },
    "fp4*fp4->f32": {
     "gops_best": 47734.28998489446,
     "receipt": "receipts/m5-max/lane_sweep_v4.json",
     "vs_f16": 0.886
    },
    "f16*f16->f16": {
     "gops_best": 62057.35594153163,
     "receipt": "receipts/m5-max/integer_lanes.json",
     "vs_f16": 1.0
    },
    "bf16*bf16->f32": {
     "gops_best": 62520.20729585634,
     "receipt": "receipts/m5-max/integer_lanes.json",
     "vs_f16": 1.007
    }
   },
   "mixed_lanes": {
    "f16_mx_fp4->f32": {
     "gops_best": 44764.74287437612,
     "receipt": "receipts/m5-max/lane_sweep_v4.json",
     "vs_f16": 0.831
    },
    "f16*fp4->f32": {
     "gops_best": 55954.789797530066,
     "receipt": "receipts/m5-max/lane_sweep_v4.json",
     "vs_f16": 1.038
    },
    "f16*i8->f32": {
     "gops_best": 61643.91165807172,
     "receipt": "receipts/m5-max/integer_lanes.json",
     "vs_f16": 0.993
    },
    "f16*i4b->f32": {
     "gops_best": 61507.69893179103,
     "receipt": "receipts/m5-max/integer_lanes.json",
     "vs_f16": 0.991
    }
   },
   "integer_lanes": {
    "i8*i8->i32": {
     "gops_best": 116368.90804620406,
     "receipt": "receipts/m5-max/integer_lanes.json",
     "vs_f16": 1.874
    },
    "i8*i4b->i32": {
     "gops_best": 95014.83139188543,
     "receipt": "receipts/m5-max/integer_lanes.json",
     "vs_f16": 1.53
    }
   },
   "gpu_cores": 40,
   "note": "Measured on the 40-core M5 Max SKU; other M5 Max configurations were not measured."
  },
  "m5-pro": {
   "device_name": "Apple M5 Pro",
   "architecture": "applegpu_g17s",
   "memory_gb": 64,
   "mlx_at_measurement": "0.32.3",
   "evidence": "observed",
   "features": {
    "int8_accelerated": true,
    "fp8_accelerated": false,
    "fp4_accelerated": false
   },
   "float_lanes": {
    "e4m3*e4m3->f32": {
     "gops_best": 29968.145628183887,
     "receipt": "receipts/m5-pro/lane_sweep.json",
     "vs_f16": 1.023
    },
    "t_e4m3*e4m3->f32": {
     "gops_best": 29795.990175213865,
     "receipt": "receipts/m5-pro/lane_sweep.json",
     "vs_f16": 1.017
    },
    "mx_e4m3*e4m3->f32": {
     "gops_best": 25567.26047084658,
     "receipt": "receipts/m5-pro/lane_sweep.json",
     "vs_f16": 0.873
    },
    "mx_fp4*fp4->f32": {
     "gops_best": 21669.810837644007,
     "receipt": "receipts/m5-pro/lane_sweep.json",
     "vs_f16": 0.74
    },
    "f16*f16->f32": {
     "gops_best": 29285.948650879876,
     "receipt": "receipts/m5-pro/lane_sweep.json",
     "vs_f16": 1.0
    },
    "fp4*fp4->f32": {
     "gops_best": 26321.73740390048,
     "receipt": "receipts/m5-pro/lane_sweep.json",
     "vs_f16": 0.899
    },
    "f16*f16->f16": {
     "gops_best": 31896.25157803708,
     "receipt": "receipts/m5-pro/integer_lanes.json",
     "vs_f16": 0.998
    },
    "bf16*bf16->f32": {
     "gops_best": 31892.55080564276,
     "receipt": "receipts/m5-pro/integer_lanes.json",
     "vs_f16": 0.998
    }
   },
   "mixed_lanes": {
    "f16_mx_fp4->f32": {
     "gops_best": 24197.706311657832,
     "receipt": "receipts/m5-pro/lane_sweep.json",
     "vs_f16": 0.826
    },
    "f16*fp4->f32": {
     "gops_best": 28882.321117750613,
     "receipt": "receipts/m5-pro/lane_sweep.json",
     "vs_f16": 0.986
    },
    "f16*e4m3->f32": {
     "gops_best": 29395.046855066485,
     "receipt": "receipts/m5-pro/lane_sweep.json",
     "vs_f16": 1.004
    },
    "f16_mx_e4m3->f32": {
     "gops_best": 24272.14046143158,
     "receipt": "receipts/m5-pro/lane_sweep.json",
     "vs_f16": 0.829
    },
    "f16*i8->f32": {
     "gops_best": 31207.4576656614,
     "receipt": "receipts/m5-pro/integer_lanes.json",
     "vs_f16": 0.976
    },
    "f16*i4b->f32": {
     "gops_best": 31655.19744955356,
     "receipt": "receipts/m5-pro/integer_lanes.json",
     "vs_f16": 0.99
    }
   },
   "integer_lanes": {
    "i8*i8->i32": {
     "gops_best": 61048.93796497104,
     "receipt": "receipts/m5-pro/integer_lanes.json",
     "vs_f16": 1.91
    },
    "i8*i4b->i32": {
     "gops_best": 50475.284687261206,
     "receipt": "receipts/m5-pro/integer_lanes.json",
     "vs_f16": 1.579
    }
   },
   "gpu_cores": 20,
   "note": "Measured on the 20-core M5 Pro SKU (18-core CPU, 64 GB); the GPU architecture string applegpu_g17s is shared with the measured M5 Max, so the SKU tier is not distinguishable from the architecture string alone."
  },
  "m6": {
   "device_name": "Apple M6",
   "architecture": "applegpu_g18g",
   "memory_gb": 32,
   "mlx_at_measurement": "0.32.3",
   "evidence": "observed",
   "features": {
    "int8_accelerated": true,
    "fp8_accelerated": true,
    "fp4_accelerated": false
   },
   "float_lanes": {
    "e4m3*e4m3->f32": {
     "gops_best": 28800.11845840189,
     "receipt": "receipts/m6/lane_sweep_v4.json",
     "vs_f16": 2.078
    },
    "t_e4m3*e4m3->f32": {
     "gops_best": 30006.330214444137,
     "receipt": "receipts/m6/lane_sweep_v4.json",
     "vs_f16": 2.165
    },
    "mx_e4m3*e4m3->f32": {
     "gops_best": 15610.378332321256,
     "receipt": "receipts/m6/lane_sweep_v4.json",
     "vs_f16": 1.126
    },
    "mx_fp4*fp4->f32": {
     "gops_best": 11005.094825676526,
     "receipt": "receipts/m6/lane_sweep_v4.json",
     "vs_f16": 0.794
    },
    "f16*f16->f32": {
     "gops_best": 13857.993467533226,
     "receipt": "receipts/m6/lane_sweep_v4.json",
     "vs_f16": 1.0
    },
    "fp4*fp4->f32": {
     "gops_best": 14918.882464370854,
     "receipt": "receipts/m6/lane_sweep_v4.json",
     "vs_f16": 1.077
    }
   },
   "mixed_lanes": {
    "f16_mx_fp4->f32": {
     "gops_best": 11686.737661321,
     "receipt": "receipts/m6/lane_sweep_mixed.json",
     "vs_f16": 0.836
    },
    "f16*fp4->f32": {
     "gops_best": 15053.142851251901,
     "receipt": "receipts/m6/lane_sweep_mixed.json",
     "vs_f16": 1.077
    },
    "f16*e4m3->f32": {
     "gops_best": 17687.080643733574,
     "receipt": "receipts/m6/lane_sweep_mixed.json",
     "vs_f16": 1.265
    },